[{"DOI": "10.1145/2980983.2908118", "ISSN": "0362-1340", "URL": "https://doi.org/10.1145/2980983.2908118", "abstract": "Despite several decades of research, the problem of formal verification of infinite-state systems has resisted effective automation. We describe a system \u2014 Ivy \u2014 for interactively verifying safety of infinite-state systems. Ivy\u2019s key principle is that whenever verification fails, Ivy graphically displays a concrete counterexample to induction. The user then interactively guides generalization from this counterexample. This process continues until an inductive invariant is found. Ivy searches for universally quantified invariants, and uses a restricted modeling language. This ensures that all verification conditions can be checked algorithmically. All user interactions are performed using graphical models, easing the user\u2019s task. We describe our initial experience with verifying several distributed protocols.", "author": [{"family": "Padon", "given": "Oded"}, {"family": "McMillan", "given": "Kenneth L."}, {"family": "Panda", "given": "Aurojit"}, {"family": "Sagiv", "given": "Mooly"}, {"family": "Shoham", "given": "Sharon"}], "container-title": "SIGPLAN Not.", "id": "padonIvySafetyVerification", "issue": "6", "issued": {"date-parts": [[2016, 6]]}, "keyword": "counterexamples to induction, distributed systems, invariant inference, safety verification", "page": "614-630", "publisher": "Association for Computing Machinery", "publisher-place": "New York, NY, USA", "title": "Ivy: Safety verification by interactive generalization", "title-short": "Ivy", "type": "article-journal", "volume": "51", "original_bibtex": "@article{padonIvySafetyVerification,\n title = {Ivy: safety verification by interactive generalization},\n author = {Padon, Oded and McMillan, Kenneth L. and Panda, Aurojit and Sagiv, Mooly and Shoham, Sharon},\n year = {2016},\n doi = {10.1145/2980983.2908118},\n url = {https://doi.org/10.1145/2980983.2908118},\n journal = {SIGPLAN Not.},\n volume = {51},\n number = {6},\n pages = {614\u2013630},\n publisher = {Association for Computing Machinery},\n address = {New York, NY, USA},\n keywords = {counterexamples to induction, distributed systems, invariant inference, safety verification},\n numpages = {17},\n month = {June},\n abstract = {Despite several decades of research, the problem of formal verification of infinite-state systems has resisted effective automation. We describe a system --- Ivy --- for interactively verifying safety of infinite-state systems. Ivy's key principle is that whenever verification fails, Ivy graphically displays a concrete counterexample to induction. The user then interactively guides generalization from this counterexample. This process continues until an inductive invariant is found. Ivy searches for universally quantified invariants, and uses a restricted modeling language. This ensures that all verification conditions can be checked algorithmically. All user interactions are performed using graphical models, easing the user's task. We describe our initial experience with verifying several distributed protocols.},\n issn = {0362-1340},\n issue_date = {June 2016}\n}\n"}]