[{"ISBN": "1575866269", "abstract": "Grammatical Framework is a programming language designed for writing grammars, which has the capability of addressing several languages in parallel. This thorough introduction demonstrates how to write grammars in Grammatical Framework and use them in applications such as tourist phrasebooks, spoken dialogue systems, and natural language interfaces. The examples and exercises presented here address several languages, and the readers are shown how to look at their own languages from the computational perspective.", "author": [{"family": "Ranta", "given": "Aarne"}], "id": "ranta-2011", "issued": {"date-parts": [[2011]]}, "publisher": "Center for the Study of Language; Information/SRI", "title": "Grammatical framework: Programming with multilingual grammars", "title-short": "Grammatical framework", "type": "book", "original_bibtex": "@book{ranta-2011,\n title = {Grammatical Framework: Programming with Multilingual Grammars},\n author = {Ranta, Aarne},\n year = {2011},\n isbn = {1575866269},\n publisher = {Center for the Study of Language and Information/SRI},\n abstract = {Grammatical Framework is a programming language designed for writing grammars, which has the capability of addressing several languages in parallel. This thorough introduction demonstrates how to write grammars in Grammatical Framework and use them in applications such as tourist phrasebooks, spoken dialogue systems, and natural language interfaces. The examples and exercises presented here address several languages, and the readers are shown how to look at their own languages from the computational perspective.}\n}\n"}]