[{"URL": "http://arxiv.org/abs/1405.0033", "abstract": "A type theory is presented that combines (intuitionistic) linear types with type dependency, thus properly generalising both intuitionistic dependent type theory and full linear logic. A syntax and complete categorical semantics are developed, the latter in terms of (strict) indexed symmetric monoidal categories with comprehension. Various optional type formers are treated in a modular way. In particular, we will see that the historically much-debated multiplicative quanti\ufb01ers and identity types arise naturally from categorical considerations. These new multiplicative connectives are further characterised by several identities relating them to the usual connectives from dependent type theory and linear logic. Finally, one important class of models, given by families with values in some symmetric monoidal category, is investigated in detail.", "accessed": {"date-parts": [[2024, 7, 10]]}, "author": [{"family": "V\u00e1k\u00e1r", "given": "Matthijs"}], "id": "vakarSyntaxSemanticsLinear2015", "issued": {"date-parts": [[2015, 1]]}, "keyword": "Computer Science - Logic in Computer Science, Computer Science - Programming Languages, Mathematics - Category Theory", "note": "arXiv:1405.0033 [cs, math]", "publisher": "arXiv", "title": "Syntax and Semantics of Linear Dependent Types", "type": "", "original_bibtex": "@misc{vakarSyntaxSemanticsLinear2015,\n title = {Syntax and {Semantics} of {Linear} {Dependent} {Types}},\n author = {V\u00e1k\u00e1r, Matthijs},\n year = {2015},\n url = {http://arxiv.org/abs/1405.0033},\n urldate = {2024-07-10},\n publisher = {arXiv},\n file = {V\u00e1k\u00e1r - 2015 - Syntax and Semantics of Linear Dependent Types.pdf:/Users/stevenschaefer/Zotero/storage/TZU67MKT/V\u00e1k\u00e1r - 2015 - Syntax and Semantics of Linear Dependent Types.pdf:application/pdf},\n keywords = {Computer Science - Logic in Computer Science, Computer Science - Programming Languages, Mathematics - Category Theory},\n note = {arXiv:1405.0033 [cs, math]},\n month = {January},\n language = {en},\n abstract = {A type theory is presented that combines (intuitionistic) linear types with type dependency, thus properly generalising both intuitionistic dependent type theory and full linear logic. A syntax and complete categorical semantics are developed, the latter in terms of (strict) indexed symmetric monoidal categories with comprehension. Various optional type formers are treated in a modular way. In particular, we will see that the historically much-debated multiplicative quanti\ufb01ers and identity types arise naturally from categorical considerations. These new multiplicative connectives are further characterised by several identities relating them to the usual connectives from dependent type theory and linear logic. Finally, one important class of models, given by families with values in some symmetric monoidal category, is investigated in detail.}\n}\n"}]