[{"DOI": "10.1007/978-981-97-2300-3_2", "ISBN": "978-981-97-2299-0", "URL": "https://doi.org/10.1007/978-981-97-2300-3_2", "abstract": "Abstract categorial grammars (ACGs) is an expressive grammatical framework whose formal properties have been extensively studied. While it can provide its own account, as a grammar, of linguistic phenomena, it is known to encode several grammatical formalisms, including context-free grammars, but also mildly context-sensitive formalisms such as tree-adjoining grammars or m-linear context-free rewriting systems for which parsing is polynomial. The ACG toolkit we present provides a compiler, acgc, that checks and turns ACGs into representations that are suitable for testing and parsing, used in the acg interpreter. We illustrate these functionalities and discuss implementation features, in particular the Datalog reduction on which parsing is based, and the magic set rewriting techniques that can further be applied.", "author": [{"family": "Guillaume", "given": "Maxime"}, {"family": "Pogodalla", "given": "Sylvain"}, {"family": "Tourneur", "given": "Vincent"}], "container-title": "Functional and logic programming: 17th international symposium, FLOPS 2024, kumamoto, japan, may 15\u201317, 2024, proceedings", "id": "Guillaume2024", "issued": {"date-parts": [[2024]]}, "keyword": "Abstract Categorial Grammars, Natural Language Processing, OCaml, Datalog", "page": "13-30", "publisher": "Springer-Verlag", "publisher-place": "Berlin, Heidelberg", "title": "ACGtk: A toolkit for developing and running abstract categorial grammars", "title-short": "ACGtk", "type": "paper-conference", "original_bibtex": "@inproceedings{Guillaume2024,\n title = {ACGtk: A Toolkit for Developing and Running Abstract Categorial Grammars},\n author = {Guillaume, Maxime and Pogodalla, Sylvain and Tourneur, Vincent},\n year = {2024},\n isbn = {978-981-97-2299-0},\n doi = {10.1007/978-981-97-2300-3_2},\n url = {https://doi.org/10.1007/978-981-97-2300-3_2},\n booktitle = {Functional and Logic Programming: 17th International Symposium, FLOPS 2024, Kumamoto, Japan, May 15\u201317, 2024, Proceedings},\n pages = {13\u201330},\n publisher = {Springer-Verlag},\n address = {Berlin, Heidelberg},\n location = {Kumamoto, Japan},\n keywords = {Abstract Categorial Grammars, Natural Language Processing, OCaml, Datalog},\n numpages = {18},\n abstract = {Abstract categorial grammars (ACGs) is an expressive grammatical framework whose formal properties have been extensively studied. While it can provide its own account, as a grammar, of linguistic phenomena, it is known to encode several grammatical formalisms, including context-free grammars, but also mildly context-sensitive formalisms such as tree-adjoining grammars or m-linear context-free rewriting systems for which parsing is polynomial. The ACG toolkit we present provides a compiler, acgc, that checks and turns ACGs into representations that are suitable for testing and parsing, used in the acg interpreter. We illustrate these functionalities and discuss implementation features, in particular the Datalog reduction on which parsing is based, and the magic set rewriting techniques that can further be applied.}\n}\n"}]