[{"DOI": "https://doi.org/10.1016/S0019-9958(65)90426-2", "ISSN": "0019-9958", "URL": "https://www.sciencedirect.com/science/article/pii/S0019995865904262", "abstract": "There has been much recent interest in languages whose grammar is sufficiently simple that an efficient left-to-right parsing algorithm can be mechanically produced from the grammar. In this paper, we define LR(k) grammars, which are perhaps the most general ones of this type, and they provide the basis for understanding all of the special tricks which have been used in the construction of parsing algorithms for languages with simple structure, e.g. algebraic languages. We give algorithms for deciding if a given grammar satisfies the LR(k) condition, for given k, and also give methods for generating recognizes for LR(k) grammars. It is shown that the problem of whether or not a grammar is LR(k) for some k is undecidable, and the paper concludes by establishing various connections between LR(k) grammars and deterministic languages. In particular, the LR(k) condition is a natural analogue, for grammars, of the deterministic condition, for languages.", "author": [{"family": "Knuth", "given": "Donald E."}], "container-title": "Information and Control", "id": "KNUTH1965607", "issue": "6", "issued": {"date-parts": [[1965]]}, "page": "607-639", "title": "On the translation of languages from left to right", "type": "article-journal", "volume": "8", "original_bibtex": "@article{KNUTH1965607,\n title = {On the translation of languages from left to right},\n author = {Donald E. Knuth},\n year = {1965},\n doi = {https://doi.org/10.1016/S0019-9958(65)90426-2},\n url = {https://www.sciencedirect.com/science/article/pii/S0019995865904262},\n journal = {Information and Control},\n volume = {8},\n number = {6},\n pages = {607-639},\n abstract = {There has been much recent interest in languages whose grammar is sufficiently simple that an efficient left-to-right parsing algorithm can be mechanically produced from the grammar. In this paper, we define LR(k) grammars, which are perhaps the most general ones of this type, and they provide the basis for understanding all of the special tricks which have been used in the construction of parsing algorithms for languages with simple structure, e.g. algebraic languages. We give algorithms for deciding if a given grammar satisfies the LR(k) condition, for given k, and also give methods for generating recognizes for LR(k) grammars. It is shown that the problem of whether or not a grammar is LR(k) for some k is undecidable, and the paper concludes by establishing various connections between LR(k) grammars and deterministic languages. In particular, the LR(k) condition is a natural analogue, for grammars, of the deterministic condition, for languages.},\n issn = {0019-9958}\n}\n"}]