[{"DOI": "10.1007/BFb0022251", "ISBN": "978-3-540-60017-6 978-3-540-49404-1", "URL": "http://link.springer.com/10.1007/BFb0022251", "abstract": "Intuitionistic linear logic regains the expressive power of intuitionistic logic through the ! (\u2019of course\u2019) modality. Benton, Bierman, Hyland and de Paiva have given a term assignment system for ILL and an associated notion of categorical model in which the ! modality is modelled by a comonad satisfying certain extra conditions. Ordinary intuitionistic logic is then modelled in a cartesian dosed category which arises as a full subcategory of the category of coalgebras for the comonad. This paper attempts to explain the connection between ILL and IL more directly and symmetricallyby giving a logic, term calculus and categorical model for a system in which the linear and non-linear worlds exist on an equal footing, with operations allowing one to pass in both directions. We start from the categorical model of ILL given by Benton, Bierman, Hyland and de Paiva and show that this is equivalent to having a symmetric monoidal adjunction between a symmetric monoidal dosed category and a cartesian closed category. We then derive both a sequent calculus and a natural deduction presentation of the logic corresponding to the new notion of model.", "accessed": {"date-parts": [[2024, 4, 27]]}, "author": [{"family": "Benton", "given": "P. N."}], "container-title": "Computer Science Logic", "editor": [{"family": "Goos", "given": "Gerhard"}, {"family": "Hartmanis", "given": "Juris"}, {"family": "Van Leeuwen", "given": "Jan"}, {"family": "Pacholski", "given": "Leszek"}, {"family": "Tiuryn", "given": "Jerzy"}], "id": "bentonMixedLinearNonlinear1995", "issued": {"date-parts": [[1995]]}, "note": "Series Title: Lecture Notes in Computer Science", "page": "121-135", "publisher": "Springer Berlin Heidelberg", "publisher-place": "Berlin, Heidelberg", "title": "A mixed linear and non-linear logic: Proofs, terms and models: Extended abstract", "title-short": "A mixed linear and non-linear logic", "type": "chapter", "volume": "933", "original_bibtex": "@incollection{bentonMixedLinearNonlinear1995,\n title = {A mixed linear and non-linear logic: {Proofs}, terms and models: {Extended} abstract},\n author = {Benton, P. N.},\n year = {1995},\n isbn = {978-3-540-60017-6 978-3-540-49404-1},\n doi = {10.1007/BFb0022251},\n url = {http://link.springer.com/10.1007/BFb0022251},\n urldate = {2024-04-27},\n booktitle = {Computer {Science} {Logic}},\n editor = {Goos, Gerhard and Hartmanis, Juris and Van Leeuwen, Jan and Pacholski, Leszek and Tiuryn, Jerzy},\n volume = {933},\n pages = {121--135},\n publisher = {Springer Berlin Heidelberg},\n address = {Berlin, Heidelberg},\n file = {BFb0022251.pdf:/Users/stevenschaefer/Downloads/BFb0022251.pdf:application/pdf},\n note = {Series Title: Lecture Notes in Computer Science},\n language = {en},\n abstract = {Intuitionistic linear logic regains the expressive power of intuitionistic logic through the ! ('of course') modality. Benton, Bierman, Hyland and de Paiva have given a term assignment system for ILL and an associated notion of categorical model in which the ! modality is modelled by a comonad satisfying certain extra conditions. Ordinary intuitionistic logic is then modelled in a cartesian dosed category which arises as a full subcategory of the category of coalgebras for the comonad. This paper attempts to explain the connection between ILL and IL more directly and symmetricallyby giving a logic, term calculus and categorical model for a system in which the linear and non-linear worlds exist on an equal footing, with operations allowing one to pass in both directions. We start from the categorical model of ILL given by Benton, Bierman, Hyland and de Paiva and show that this is equivalent to having a symmetric monoidal adjunction between a symmetric monoidal dosed category and a cartesian closed category. We then derive both a sequent calculus and a natural deduction presentation of the logic corresponding to the new notion of model.},\n shorttitle = {A mixed linear and non-linear logic}\n}\n"}]