[{"ISBN": "978-3-031-75380-0", "abstract": "In prior work\u00a0[13], we introduced\u00a0a procedure for deriving minimum formulas in first-order logic\u00a0(FOL) for the reachable states of a restricted class of multi-sorted distributed protocol specifications: protocols with\u00a0sorts representing unbounded sets of symmetric (indistinguishable) elements. This paper provides a deeper analysis of this idea\u00a0that yields additional insights about the oft-cited observation that\u00a0the behavior of such protocols can be inferred from analyzing relatively small finite instances whereby a protocol\u2019s behavior becomes invariant, i.e. saturates\u00a0[24], beyond certain cutoff sizes of its sorts. The\u00a0paper discusses several issues in previous work\u00a0[13] and provides more succinct FOL formulas of the reachable states\u00a0for a collection of common protocols.", "author": [{"family": "Luo", "given": "Yun-Rong"}, {"family": "Goel", "given": "Aman"}, {"family": "Sakallah", "given": "Karem"}], "container-title": "Leveraging applications of formal methods, verification and validation. Specification and verification", "editor": [{"family": "Margaria", "given": "Tiziana"}, {"family": "Steffen", "given": "Bernhard"}], "id": "LuoSatBasedQuantifiedSymmetric", "issued": {"date-parts": [[2025]]}, "page": "374-384", "publisher": "Springer Nature Switzerland", "publisher-place": "Cham", "title": "SAT-based quantified symmetric minimization of\u00a0the\u00a0reachable states of\u00a0distributed protocols: An update", "title-short": "SAT-based quantified symmetric minimization of\u00a0the\u00a0reachable states of\u00a0distributed protocols", "type": "paper-conference", "original_bibtex": "@inproceedings{LuoSatBasedQuantifiedSymmetric,\n title = {SAT-Based Quantified Symmetric Minimization of\u00a0the\u00a0Reachable States of\u00a0Distributed Protocols: An Update},\n author = {Luo, Yun-Rong\nand Goel, Aman\nand Sakallah, Karem},\n year = {2025},\n isbn = {978-3-031-75380-0},\n booktitle = {Leveraging Applications of Formal Methods, Verification and Validation. Specification and Verification},\n editor = {Margaria, Tiziana\nand Steffen, Bernhard},\n pages = {374--384},\n publisher = {Springer Nature Switzerland},\n address = {Cham},\n abstract = {In prior work\u00a0[13], we introduced\u00a0a procedure for deriving minimum formulas in first-order logic\u00a0(FOL) for the reachable states of a restricted class of multi-sorted distributed protocol specifications: protocols with\u00a0sorts representing unbounded sets of symmetric (indistinguishable) elements. This paper provides a deeper analysis of this idea\u00a0that yields additional insights about the oft-cited observation that\u00a0the behavior of such protocols can be inferred from analyzing relatively small finite instances whereby a protocol's behavior becomes invariant, i.e. saturates\u00a0[24], beyond certain cutoff sizes of its sorts. The\u00a0paper discusses several issues in previous work\u00a0[13] and provides more succinct FOL formulas of the reachable states\u00a0for a collection of common protocols.}\n}\n"}]